{
  "id": "trace.maya-stale-context-refresh",
  "title": "Maya stale context refresh boundary",
  "created_at": "2026-05-03T10:30:00Z",
  "description": "Activates Maya from a package whose freshness window has expired, proving that the report exposes the stale package and refresh-before-external-action boundary.",
  "seed_records": [
    {
      "collection": "package",
      "path": "examples/maya-southern-abrasives-opportunity-context-package.json"
    }
  ],
  "agent_activation": {
    "package_id": "context.maya.southern-abrasives-won-opportunity",
    "consumer_ref": "consumer.codex",
    "created_at": "2026-05-03T10:30:00Z",
    "activation_goal": "Review whether any external-facing marketing action is still safe from this package.",
    "expected_response_type": "review",
    "activation_id": "activation.maya.stale-context-refresh"
  },
  "render_activation": {},
  "capture_response": {
    "package_id": "context.maya.southern-abrasives-won-opportunity",
    "consumer_ref": "consumer.codex",
    "created_at": "2026-05-03T10:32:00Z",
    "activation_id": "activation.maya.stale-context-refresh",
    "response_text": "This package is stale for external action. I can identify the missing refresh evidence, but I will not recommend publishing or sending external copy until the deal permission and proof-point evidence are refreshed.\n"
  }
}
